{
    "raw_idea":  "我想把模糊 AI builder 任务规划成可验证执行包。",
    "trigger_reasons":  [
                            "模糊任务直接进入执行会导致方向跑偏。"
                        ],
    "problem_statement":  "AI builder 缺少从模糊想法到可执行需求模型的稳定中间层。",
    "current_state":  "用户只有模糊想法，AI 容易直接进入执行。",
    "target_state":  "用户获得可被 Agile 和 Harness 使用的结构化需求模型。",
    "target_users":  [
                         "AI Agent builder"
                     ],
    "usage_scenarios":  [
                            "创建 Skill 前",
                            "设计 Agent 前",
                            "复杂任务规划前"
                        ],
    "jobs_to_be_done":  [
                            "把模糊想法转成可执行、可验证、可交付的需求模型。"
                        ],
    "desired_outputs":  [
                            "Task Execution Pack"
                        ],
    "scope_in":  [
                     "需求挖掘",
                     "需求建模",
                     "进入 Agile 前的 readiness gate"
                 ],
    "scope_out":  [
                      "直接执行用户业务代码",
                      "连接生产环境",
                      "替代 Jira 或 Linear"
                  ],
    "constraints":  [
                        "默认中文表达",
                        "JSON 文件是机器事实源"
                    ],
    "success_criteria":  [
                             "需求模型字段完整",
                             "blocking questions 为空",
                             "可进入 Agile 规划"
                         ],
    "failure_criteria":  [
                             "缺少 problem statement",
                             "缺少目标用户",
                             "缺少使用场景"
                         ],
    "requirement_groups":  [
                               {
                                   "name":  "需求建模",
                                   "items":  [
                                                 "真实问题",
                                                 "目标状态",
                                                 "用户场景"
                                             ]
                               }
                           ],
    "priorities":  [
                       {
                           "item":  "requirement-model.json",
                           "priority":  "Must"
                       }
                   ],
    "validation_evidence":  [
                                "valid fixture evaluator pass"
                            ],
    "blocking_questions":  [

                           ]
}
